{
  "$schema": "https://json-schema.org/draft/2020-12/schema",
  "$id": "https://sih26168.invalid/contracts/schemas/common/evidence_envelope_v1.schema.json",
  "title": "EvidenceEnvelopeV1",
  "description": "Normative canonical evidence envelope for SIH26168 stream observations and recorded events, encapsulating monotonic timebase, provenance lineage, semantic quality gates, and typed payload.",
  "type": "object",
  "additionalProperties": true,
  "required": [
    "schema_version",
    "payload_type",
    "timestamp",
    "provenance",
    "payload",
    "validity_gate"
  ],
  "properties": {
    "schema_version": {
      "type": "integer",
      "const": 1,
      "description": "Major schema version of the envelope contract."
    },
    "payload_type": {
      "type": "string",
      "minLength": 1,
      "description": "Canonical type name of the encapsulated payload (e.g., RawSensorSample, LocationGnssFix, UiNavigationSnapshot)."
    },
    "timestamp": {
      "$ref": "timestamp_v1.schema.json"
    },
    "provenance": {
      "$ref": "provenance_v1.schema.json"
    },
    "payload": {
      "type": "object",
      "description": "Encapsulated domain-specific payload matching payload_type."
    },
    "validity_gate": {
      "type": "object",
      "additionalProperties": true,
      "required": [
        "is_finite",
        "is_valid"
      ],
      "properties": {
        "is_finite": {
          "type": "boolean",
          "description": "True if all numerical elements in payload satisfy IEEE 754 isfinite() checks.",
          "default": true
        },
        "is_valid": {
          "type": "boolean",
          "description": "True if payload satisfies physical range envelope and quality constraints.",
          "default": true
        },
        "rejection_code": {
          "type": [
            "string",
            "null"
          ],
          "description": "Diagnostic error or rejection code if sample is gated out of core estimation."
        },
        "flags": {
          "type": "integer",
          "minimum": 0,
          "description": "Status or failure bitmask flags.",
          "default": 0
        }
      }
    }
  }
}
