{
  "schema_version": 1,
  "payload_type": "RawSensorSample",
  "timestamp": {
    "epoch_ns": 1725450000000000000,
    "arrival_elapsed_realtime_ns": 3456789000000,
    "source_timestamp_ns": 3456788950000,
    "clock_id": "CLOCK_BOOTTIME"
  },
  "provenance": {
    "evidence_id": "ev-syn-0001",
    "session_id": "sess-synthetic-fixture-01",
    "stream_id": "sensor_accel",
    "device_id": "fixture-device-virtual",
    "build_id": "ci-test-fixture",
    "provenance_type": "DETERMINISTIC_REPLAY",
    "synthetic": true,
    "contributing_evidence_ids": []
  },
  "payload": {
    "sensor_type": "ACCELEROMETER",
    "values": [
      0.012,
      -0.034,
      9.80665
    ],
    "accuracy": 3
  },
  "validity_gate": {
    "is_finite": true,
    "is_valid": true,
    "flags": 0
  }
}
